{
  "$schema": "http://json-schema.org/draft-07/schema#",
  "title": "CLI Plugin Schema (Simplified)",
  "type": "object",
  "properties": {
    "metadata": {"type": "object"},
    "version": {"type": "string"},
    "status": {"type": "string"},
    "author": {"type": "string"},
    "date": {"type": "string"},
    "license": {"type": "string"},
    "artifact_id": {"type": "string"},
    "summary": {"type": "string"},
    "tags": {"type": "array"},
    "commands": {"type": "array"},
    "queues": {"type": "array"},
    "workflows": {"type": "array"}
  }
}
