{
  "version": "0.1.0",
  "status": "Draft",
  "author": "@kpblcaoo",
  "date": "2025-05-22",
  "license": "GPL-3.0",
  "artifact_id": "e5f6a7b8-c9d0-41e2-f3a4-b5c6d7e8f9a0",
  "metadata": {
    "project_name": "llmstruct",
    "description": "CLI commands for llmstruct",
    "authors": [{"name": "@kpblcaoo", "github": "kpblcaoo", "email": "kpblcaoo@example.com"}]
  },
  "summary": "CLI commands for llmstruct",
  "tags": ["cli"],
  "commands": [
    {
      "name": "parse",
      "description": "Parse codebase and generate struct.json",
      "arguments": [
        {"name": "root_dir", "type": "string", "required": true, "description": "Root directory of the project"},
        {"name": "output", "type": "string", "required": false, "description": "Output JSON file"},
        {"name": "filters", "type": "array", "required": false, "description": "Glob patterns to filter files"},
        {"name": "use_cache", "type": "boolean", "required": false, "description": "Cache generated JSON"}
      ],
      "examples": [
        {"command": "llmstruct parse . --output struct.json --filters src/*,!tests/*", "description": "Generate struct.json with filters"}
      ],
      "prompt_templates": ["Parse codebase in {root_dir} with filters {filters} and output to {output}"],
      "related_tasks": ["TSK-006", "TSK-126"],
      "related_ideas": ["IDEA-001"]
    },
    {
      "name": "interactive",
      "description": "Run interactive CLI with LLM",
      "arguments": [
        {"name": "root_dir", "type": "string", "required": true, "description": "Root directory of the project"},
        {"name": "context", "type": "string", "required": false, "description": "Context JSON file"}
      ],
      "examples": [{"command": "llmstruct interactive . --context init.json", "description": "Start interactive mode"}],
      "prompt_templates": ["Run interactive CLI for {root_dir} with context {context}"],
      "related_tasks": ["TSK-119"],
      "related_ideas": ["IDEA-126"]
    }
  ]
}